{
  "schema": "shared-skills-registry/v2",
  "_ssot": "Rulings only -- no machine paths and no scan output. Paths live in the gitignored sites.local.json so any clone works in any directory; frozen hashes are never stored because a hash that disagrees with reality is worse than no record at all.",
  "_rule": "A skill is either shared infrastructure (exactly one copy, here, reached from every project through the user-level surfaces) or repo-owned (differentiated on purpose, living in that repo's big loop). Nothing is both. A repo holding its own copy of a shared name shadows the shared one silently -- that is what `check` exists to catch. A third state exists as of 2026-08-07: a name can be deliberately repo-owned in several repos at once. That is not shadowing -- nothing shared is being hidden -- so `check` must not report it as drift.",
  "canonical_root": "skills",
  "shared": [
    {"name":"shared-skills-infra","admitted":"2026-08-07","why":"The governance tool has to sit under its own rule, or the one skill that can detect shadowing is the one nothing checks."},
    {"name":"github-delivery-loop","admitted":"2026-08-07","why":"Merge authority is host infrastructure, not repo policy: the same four-layer stack and the same two hosts gate every repo. It was already split into a v0.1 and a v1.1, and that split is precisely why the same blockers kept recurring."},
    {"name":"autoresearch-composer","admitted":"2026-08-07","why":"Core-three consensus 3/3 on 2026-08-07 (bettor-arena/skill-bettor/ts-skill-bettor). Method/host infrastructure with no repo-specific content. The ix-agy and antigravity variants were merged into this body on 2026-08-07 rather than left deferred; their host-bound halves moved to each repo's .skill-bindings. Their local copies still need removing by hand -- the host gate blocks deletions -- until then they shadow this body."},
    {"name":"dr-research-loop","admitted":"2026-08-07","why":"Core-three consensus 3/3 on 2026-08-07 (bettor-arena/skill-bettor/ts-skill-bettor). Method/host infrastructure with no repo-specific content. The ix-agy and antigravity variants were merged into this body on 2026-08-07 rather than left deferred; their host-bound halves moved to each repo's .skill-bindings. Their local copies still need removing by hand -- the host gate blocks deletions -- until then they shadow this body."},
    {"name":"dr-to-mvp","admitted":"2026-08-07","why":"Core-three consensus 3/3 on 2026-08-07 (bettor-arena/skill-bettor/ts-skill-bettor). Method/host infrastructure with no repo-specific content. The ix-agy and antigravity variants were merged into this body on 2026-08-07 rather than left deferred; their host-bound halves moved to each repo's .skill-bindings. Their local copies still need removing by hand -- the host gate blocks deletions -- until then they shadow this body."},
    {"name":"judge-loop-chooser","admitted":"2026-08-07","why":"Core-three consensus 3/3 on 2026-08-07 (bettor-arena/skill-bettor/ts-skill-bettor). Method/host infrastructure with no repo-specific content. The ix-agy and antigravity variants were merged into this body on 2026-08-07 rather than left deferred; their host-bound halves moved to each repo's .skill-bindings. Their local copies still need removing by hand -- the host gate blocks deletions -- until then they shadow this body."},
    {"name":"loop-harness-review-handoff","admitted":"2026-08-07","why":"Core-three consensus 3/3 on 2026-08-07 (bettor-arena/skill-bettor/ts-skill-bettor). Method/host infrastructure with no repo-specific content. The ix-agy and antigravity variants were merged into this body on 2026-08-07 rather than left deferred; their host-bound halves moved to each repo's .skill-bindings. Their local copies still need removing by hand -- the host gate blocks deletions -- until then they shadow this body."},
    {"name":"path-b-reduction","admitted":"2026-08-07","why":"Core-three consensus 3/3 on 2026-08-07 (bettor-arena/skill-bettor/ts-skill-bettor). Method/host infrastructure with no repo-specific content. The ix-agy and antigravity variants were merged into this body on 2026-08-07 rather than left deferred; their host-bound halves moved to each repo's .skill-bindings. Their local copies still need removing by hand -- the host gate blocks deletions -- until then they shadow this body."},
    {"name":"external-verify","admitted":"2026-08-07","why":"Core-three consensus 2/3 on 2026-08-07 (bettor-arena/skill-bettor/ts-skill-bettor). Method/host infrastructure with no repo-specific content. The ix-agy and antigravity variants were merged into this body on 2026-08-07 rather than left deferred; their host-bound halves moved to each repo's .skill-bindings. Their local copies still need removing by hand -- the host gate blocks deletions -- until then they shadow this body."},
    {"name":"fold-in","admitted":"2026-08-07","why":"Core-three consensus 2/3 on 2026-08-07 (bettor-arena/skill-bettor/ts-skill-bettor). Method/host infrastructure with no repo-specific content. The ix-agy and antigravity variants were merged into this body on 2026-08-07 rather than left deferred; their host-bound halves moved to each repo's .skill-bindings. Their local copies still need removing by hand -- the host gate blocks deletions -- until then they shadow this body."},
    {"name":"gemini-conversation-research","admitted":"2026-08-07","why":"Core-three consensus 2/3 on 2026-08-07 (bettor-arena/skill-bettor/ts-skill-bettor). Method/host infrastructure with no repo-specific content. The ix-agy and antigravity variants were merged into this body on 2026-08-07 rather than left deferred; their host-bound halves moved to each repo's .skill-bindings. Their local copies still need removing by hand -- the host gate blocks deletions -- until then they shadow this body."},
    {"name":"html-for-decisions","admitted":"2026-08-07","why":"Core-three consensus 2/3 on 2026-08-07 (bettor-arena/skill-bettor/ts-skill-bettor). Method/host infrastructure with no repo-specific content. The ix-agy and antigravity variants were merged into this body on 2026-08-07 rather than left deferred; their host-bound halves moved to each repo's .skill-bindings. Their local copies still need removing by hand -- the host gate blocks deletions -- until then they shadow this body."},
    {"name":"repo-agent-native","admitted":"2026-08-07","why":"Core-three consensus 2/3 on 2026-08-07 (bettor-arena/skill-bettor/ts-skill-bettor). Method/host infrastructure with no repo-specific content. The ix-agy and antigravity variants were merged into this body on 2026-08-07 rather than left deferred; their host-bound halves moved to each repo's .skill-bindings. Their local copies still need removing by hand -- the host gate blocks deletions -- until then they shadow this body."},
    {"name":"sdlc-plan-composer","admitted":"2026-08-07","why":"Core-three consensus 2/3 on 2026-08-07 (bettor-arena/skill-bettor/ts-skill-bettor). Method/host infrastructure with no repo-specific content. The ix-agy and antigravity variants were merged into this body on 2026-08-07 rather than left deferred; their host-bound halves moved to each repo's .skill-bindings. Their local copies still need removing by hand -- the host gate blocks deletions -- until then they shadow this body."},
    {"name":"truth-verify-loop","admitted":"2026-08-07","why":"Core-three consensus 2/3 on 2026-08-07 (bettor-arena/skill-bettor/ts-skill-bettor). Method/host infrastructure with no repo-specific content. The ix-agy and antigravity variants were merged into this body on 2026-08-07 rather than left deferred; their host-bound halves moved to each repo's .skill-bindings. Their local copies still need removing by hand -- the host gate blocks deletions -- until then they shadow this body."},
    {"name":"unknown-discovery-composer","admitted":"2026-08-07","why":"Core-three consensus 2/3 on 2026-08-07 (bettor-arena/skill-bettor/ts-skill-bettor). Method/host infrastructure with no repo-specific content. The ix-agy and antigravity variants were merged into this body on 2026-08-07 rather than left deferred; their host-bound halves moved to each repo's .skill-bindings. Their local copies still need removing by hand -- the host gate blocks deletions -- until then they shadow this body."},
    {"name":"gitlab-delivery-loop","admitted":"2026-08-07","why":"Same reason as its GitHub sibling: merge authority is host infrastructure, not repo policy -- the same four-layer stack and the same two hosts gate every repo. Kept as a separate name rather than a --host flag on github-delivery-loop because the two forges must not be interchangeable at run time; the split is enforced by disjoint schemas, disjoint identity fields and a cross-forge refusal test, not by documentation."},
    {"name":"knowledge-continuity","admitted":"2026-08-07","why":"Only ix-agy had it, and nothing in it is about ix-agy. A skill that one repo happens to have written is not thereby repo-owned."},
    {"name":"repo-fullstack-debugger","admitted":"2026-08-07","why":"Two repos, two lines of difference. The antigravity copy was the superset -- it carried the note on when to hand off to a different model family instead."},
    {"name":"forgejo-delivery-loop","admitted":"2026-08-07","why":"bettor-arena holds the mechanism; the ts-skill-bettor copy says so itself in its own header, which makes it a binding, not a second body. Kept separate from the GitHub and GitLab siblings by the earlier ruling: the forges must not be interchangeable at run time. 2026-08-07: absorbed forgejo-loop-ops, which was the operations half of the same loop -- one skill said which line to work, the other how to move it without leaving half-applied state, and splitting them made 'which one first' a question you had to answer every time. Its router, cases and contracts moved in whole; the selftest still runs 19/19.","absorbed":["forgejo-loop-ops"]},